{
  "schemaVersion": "curveyield-development-agent-task-request-v1",
  "status": "READY",
  "managerId": "audit-automation-upgrade-v1",
  "specificationPath": "process/development-agent-task-manager/specifications/AUDIT_AUTOMATION_UPGRADE_SPECIFICATION_v1.md",
  "skillPath": "process/development-agent-task-manager/authority/audit-v7-v38.3.4/SKILL_AUTHORITY_INDEX_v1.md",
  "authorityRef": "main",
  "targetRepository": "CurveYield2/Contract-Automation",
  "targetBranch": "upgrade/lite-evidence-ingestion-v1",
  "baseRef": "main",
  "initialAssignment": "GitHub live state is final authority for current implementation status. Begin by reading CurveYield_Audit_Automation_Upgrade_Handoff_v10.md on Contract-Automation main and reconciling it with current open PRs, commits, qualification runs, and Audit-Controller main.\n\nImmediate finite resume point: Contract-Automation PR #325 (upgrade/lite-evidence-ingestion-v1) is the admitted Stage C.7 lane. Do not restart C.1-C.6. Diagnose the existing failed FULL qualification evidence for C.7, repair only the real defect, rerun required qualification, and merge only after PASS. Do not weaken gates.\n\nAfter C.7 is accepted, update the living root handoff and continue the next finite incomplete item from the approved automation-upgrade specification. Keep using this durable development branch as the manager checkpoint branch across successive PRs; after a merge, reconcile it to current main before starting the next scoped change.\n\nExisting-process-first is mandatory. Reuse/extend/refactor admitted workflows, bridges, queues, ingestors, evidence models and watchdog/wake primitives before creating anything new. Never add GitHub Actions workflows to Audit-Controller; all workflows belong in Contract-Automation.\n\nThe admitted Audit V7 v38.3.4 authority index points to five exact SKILL.md parts. Read the index and all five parts in order for development methodology constraints; during actual audit execution preserve the skill's progressive-disclosure rules.\n\nCommit coherent progress frequently. If work spans Audit-Controller, ensure the Contract-Automation checkpoint branch contains a concise durable state update naming exact cross-repository commits/PRs so a replacement agent can recover from GitHub state alone.\n\nContinue through the entire approved specification until its definition of success is actually satisfied and the machine completion receipt can truthfully be written."
}
